{
  "$schema": "urn:voidtrace:schema:catalog-snapshot:0.1.0",
  "kind": "catalog-snapshot",
  "schemaVersion": "0.1.0",
  "id": "catalog.synthetic-mini",
  "revision": 0,
  "gameBuild": "synthetic-fixture-0",
  "source": {
    "kind": "fixture",
    "description": "Synthetic package-test data only; all names and values are invented and are not Warframe data or mechanics claims."
  },
  "weapons": [
    {
      "id": "weapon.synthetic-aperture",
      "label": "Synthetic Aperture Fixture",
      "attackModes": [
        {
          "id": "attack-mode.synthetic-aperture.primary",
          "label": "Synthetic Primary Hitscan Fixture",
          "delivery": "hitscan",
          "baseDamage": {
            "damage.synthetic-kinetic": 100
          },
          "criticalChance": 0.25,
          "criticalMultiplier": 2
        },
        {
          "id": "attack-mode.synthetic-aperture.radial",
          "label": "Synthetic Radial Hitscan Fixture",
          "delivery": "hitscan",
          "baseDamage": {
            "damage.synthetic-kinetic": 80
          },
          "criticalChance": 0.25,
          "criticalMultiplier": 2
        }
      ]
    }
  ],
  "targets": [
    {
      "id": "target.synthetic-calibration",
      "label": "Synthetic Calibration Target Fixture",
      "baseHealth": 1000,
      "baseShield": 0,
      "baseArmor": 300,
      "baseOverguard": 0
    }
  ],
  "mods": [
    {
      "id": "mod.synthetic-damage-add",
      "label": "Synthetic Additive Damage Fixture",
      "effects": [
        {
          "stat": "stat.base-damage",
          "operation": "add",
          "value": 0.5
        }
      ]
    },
    {
      "id": "mod.synthetic-critical-multiply",
      "label": "Synthetic Critical Chance Multiplier Fixture",
      "effects": [
        {
          "stat": "stat.critical-chance",
          "operation": "multiply",
          "value": 1.25
        }
      ]
    },
    {
      "id": "mod.synthetic-critical-add",
      "label": "Synthetic Critical Multiplier Addition Fixture",
      "effects": [
        {
          "stat": "stat.critical-multiplier",
          "operation": "add",
          "value": 0.5
        }
      ]
    }
  ],
  "contentHash": "sha256:006b3b5671b11df87c1b1a905ba99c0c925c468bf090197f9c2de6a1c4130437"
}
